<?xml version="1.0" encoding="UTF-8"?>
<!DOCTYPE countries SYSTEM "D:\Swapnil\JAVA\src\com\jpm\xml\dtd\externaldtd.dtd"><!---SYSTEM is used if DTD is avaialbale locally on system if its on servere then Public has to be used and provide url-->
<countries>
    <country>
        <name>India</name>
        <capital>New Delhi</capital>
        <currency>INR</currency>
        <description>
            <continent>Asia</continent>
            <language>Hindi</language>
        </description>
    </country>
</countries>
